{
  "uncertainty_schema_version": "1.0",
  "uncertainty_artifact_version": "p1.3-v1",
  "availability_status": "generated",
  "method_id": "prequential_expanding_absolute_residual_quantile",
  "method_version": "p1.3-v1",
  "uncertainty_status": "temporally_evaluated_synthetic_empirical_range",
  "active_model_id": "random_forest",
  "active_model_family": "RandomForestRegressor",
  "active_model_library": "scikit-learn",
  "active_model_library_version": "1.9.0",
  "active_model_parameters_sha256": "ac37d2d2947de2f6004d39ecdfa3290c5d65901b796f1eb1fd248ad658e1b1e0",
  "candidate_registry_sha256": "2e627f8a368a7e92cebd4ad62139b1050c7614559affd620e9a41738fd6a25d4",
  "comparison_artifact_path": "data/candidate_model_comparison.json",
  "comparison_artifact_sha256": "375657605bbd3ec3ad7a14b409a98766166c215ac25e3d37bae13536f8f5fa71",
  "residual_source_artifact_path": "data/candidate_model_comparison.json",
  "residual_source_artifact_sha256": "375657605bbd3ec3ad7a14b409a98766166c215ac25e3d37bae13536f8f5fa71",
  "rolling_fold_reference_artifact_path": "data/rolling_validation.json",
  "rolling_fold_reference_artifact_sha256": "5da1fdc63c1c4ac45eed866ed8ffb3409ab64e3ffd03ecb70515514a64d39a56",
  "target": "target_cases_next_2w",
  "horizon_weeks": 2,
  "feature_order_sha256": "aeccbe517da452e1132f08c02599418523fb003280b11ff9cda66cfb3aa55a85",
  "nominal_coverage": 0.9,
  "calibration_design": {
    "design": "prequential_expanding_window_prior_residuals_only",
    "residual_definition": "actual_minus_raw_prediction",
    "calibration_score": "absolute_residual",
    "warmup_fold_count": 20,
    "evaluation_fold_count": 48,
    "final_residual_pool_count": 68,
    "quantile_rank_rule": "min(n, ceil((n + 1) * (1 - alpha)))",
    "alpha": 0.1,
    "sorting": "deterministic_ascending",
    "interpolation": "none",
    "ties": "retained_as_separate_observations",
    "coverage_rule": "lower_raw <= actual <= upper_raw",
    "lower_bound_policy": "clip_at_zero_after_raw_construction",
    "rounding_policy": "raw_for_evaluation_outward_floor_lower_ceiling_upper_for_reporting"
  },
  "residual_summary": {
    "residual_count": 68,
    "signed_residual_minimum": -76.40636813318889,
    "signed_residual_maximum": 261.22750415131503,
    "signed_residual_mean": -3.169128831927532,
    "signed_residual_median": -14.462410601264224,
    "absolute_residual_minimum": 0.8231799740493955,
    "absolute_residual_maximum": 261.22750415131503,
    "absolute_residual_mean": 31.726076401608662,
    "absolute_residual_median": 22.102701738885596
  },
  "historical_evaluation": {
    "records": [
      {
        "fold_id": "rolling-origin-0021-2023-W27-to-2023-W29",
        "target_period": "2023-W29",
        "actual": 148.0,
        "raw_prediction": 168.8765087954498,
        "prior_residual_count": 20,
        "quantile_rank": 19,
        "quantile_value": 40.139388226855345,
        "lower_raw_unclipped": 128.73712056859446,
        "lower_raw": 128.73712056859446,
        "upper_raw": 209.01589702230515,
        "lower_clipping_applied": false,
        "covered": true,
        "miss_direction": null,
        "miss_magnitude": 0.0,
        "case_quartile": 3,
        "trajectory_category": "rising"
      },
      {
        "fold_id": "rolling-origin-0022-2023-W28-to-2023-W30",
        "target_period": "2023-W30",
        "actual": 140.0,
        "raw_prediction": 170.15421294630855,
        "prior_residual_count": 21,
        "quantile_rank": 20,
        "quantile_value": 40.139388226855345,
        "lower_raw_unclipped": 130.0148247194532,
        "lower_raw": 130.0148247194532,
        "upper_raw": 210.2936011731639,
        "lower_clipping_applied": false,
        "covered": true,
        "miss_direction": null,
        "miss_magnitude": 0.0,
        "case_quartile": 3,
        "trajectory_category": "declining"
      },
      {
        "fold_id": "rolling-origin-0023-2023-W29-to-2023-W31",
        "target_period": "2023-W31",
        "actual": 172.0,
        "raw_prediction": 174.95173835341197,
        "prior_residual_count": 22,
        "quantile_rank": 21,
        "quantile_value": 40.139388226855345,
        "lower_raw_unclipped": 134.81235012655662,
        "lower_raw": 134.81235012655662,
        "upper_raw": 215.09112658026731,
        "lower_clipping_applied": false,
        "covered": true,
        "miss_direction": null,
        "miss_magnitude": 0.0,
        "case_quartile": 4,
        "trajectory_category": "rising"
      },
      {
        "fold_id": "rolling-origin-0024-2023-W30-to-2023-W32",
        "target_period": "2023-W32",
        "actual": 165.0,
        "raw_prediction": 231.48030596275706,
        "prior_residual_count": 23,
        "quantile_rank": 22,
        "quantile_value": 40.139388226855345,
        "lower_raw_unclipped": 191.3409177359017,
        "lower_raw": 191.3409177359017,
        "upper_raw": 271.6196941896124,
        "lower_clipping_applied": false,
        "covered": false,
        "miss_direction": "lower",
        "miss_magnitude": 26.340917735901712,
        "case_quartile": 4,
        "trajectory_category": "rising"
      },
      {
        "fold_id": "rolling-origin-0025-2023-W31-to-2023-W33",
        "target_period": "2023-W33",
        "actual": 162.0,
        "raw_prediction": 224.1059518881587,
        "prior_residual_count": 24,
        "quantile_rank": 23,
        "quantile_value": 43.28181463626002,
        "lower_raw_unclipped": 180.82413725189866,
        "lower_raw": 180.82413725189866,
        "upper_raw": 267.38776652441874,
        "lower_clipping_applied": false,
        "covered": false,
        "miss_direction": "lower",
        "miss_magnitude": 18.824137251898662,
        "case_quartile": 3,
        "trajectory_category": "declining"
      },
      {
        "fold_id": "rolling-origin-0026-2023-W32-to-2023-W34",
        "target_period": "2023-W34",
        "actual": 205.0,
        "raw_prediction": 243.60211197870757,
        "prior_residual_count": 25,
        "quantile_rank": 24,
        "quantile_value": 62.1059518881587,
        "lower_raw_unclipped": 181.49616009054887,
        "lower_raw": 181.49616009054887,
        "upper_raw": 305.70806386686627,
        "lower_clipping_applied": false,
        "covered": true,
        "miss_direction": null,
        "miss_magnitude": 0.0,
        "case_quartile": 4,
        "trajectory_category": "rising"
      },
      {
        "fold_id": "rolling-origin-0027-2023-W33-to-2023-W35",
        "target_period": "2023-W35",
        "actual": 286.0,
        "raw_prediction": 238.08809520871273,
        "prior_residual_count": 26,
        "quantile_rank": 25,
        "quantile_value": 62.1059518881587,
        "lower_raw_unclipped": 175.98214332055403,
        "lower_raw": 175.98214332055403,
        "upper_raw": 300.19404709687143,
        "lower_clipping_applied": false,
        "covered": true,
        "miss_direction": null,
        "miss_magnitude": 0.0,
        "case_quartile": 4,
        "trajectory_category": "rising"
      },
      {
        "fold_id": "rolling-origin-0028-2023-W34-to-2023-W36",
        "target_period": "2023-W36",
        "actual": 397.0,
        "raw_prediction": 272.49904740050175,
        "prior_residual_count": 27,
        "quantile_rank": 26,
        "quantile_value": 62.1059518881587,
        "lower_raw_unclipped": 210.39309551234305,
        "lower_raw": 210.39309551234305,
        "upper_raw": 334.60499928866045,
        "lower_clipping_applied": false,
        "covered": false,
        "miss_direction": "upper",
        "miss_magnitude": 62.39500071133955,
        "case_quartile": 4,
        "trajectory_category": "rising"
      },
      {
        "fold_id": "rolling-origin-0029-2023-W35-to-2023-W37",
        "target_period": "2023-W37",
        "actual": 254.0,
        "raw_prediction": 283.88876472795835,
        "prior_residual_count": 28,
        "quantile_rank": 27,
        "quantile_value": 66.48030596275706,
        "lower_raw_unclipped": 217.4084587652013,
        "lower_raw": 217.4084587652013,
        "upper_raw": 350.3690706907154,
        "lower_clipping_applied": false,
        "covered": true,
        "miss_direction": null,
        "miss_magnitude": 0.0,
        "case_quartile": 4,
        "trajectory_category": "declining"
      },
      {
        "fold_id": "rolling-origin-0030-2023-W36-to-2023-W38",
        "target_period": "2023-W38",
        "actual": 289.0,
        "raw_prediction": 300.78369806659634,
        "prior_residual_count": 29,
        "quantile_rank": 27,
        "quantile_value": 62.1059518881587,
        "lower_raw_unclipped": 238.67774617843764,
        "lower_raw": 238.67774617843764,
        "upper_raw": 362.88964995475504,
        "lower_clipping_applied": false,
        "covered": true,
        "miss_direction": null,
        "miss_magnitude": 0.0,
        "case_quartile": 4,
        "trajectory_category": "declining"
      },
      {
        "fold_id": "rolling-origin-0031-2023-W37-to-2023-W39",
        "target_period": "2023-W39",
        "actual": 527.0,
        "raw_prediction": 265.77249584868497,
        "prior_residual_count": 30,
        "quantile_rank": 28,
        "quantile_value": 62.1059518881587,
        "lower_raw_unclipped": 203.66654396052627,
        "lower_raw": 203.66654396052627,
        "upper_raw": 327.87844773684367,
        "lower_clipping_applied": false,
        "covered": false,
        "miss_direction": "upper",
        "miss_magnitude": 199.12155226315633,
        "case_quartile": 4,
        "trajectory_category": "rising"
      },
      {
        "fold_id": "rolling-origin-0032-2023-W38-to-2023-W40",
        "target_period": "2023-W40",
        "actual": 402.0,
        "raw_prediction": 253.10262796873744,
        "prior_residual_count": 31,
        "quantile_rank": 29,
        "quantile_value": 66.48030596275706,
        "lower_raw_unclipped": 186.62232200598038,
        "lower_raw": 186.62232200598038,